{
  "schema_version": "0.2.0", "profile_id": "fake-hermetic", "profile_version": "1.1.0",
  "provider_kind": "fake", "api_dialect": "fake",
  "endpoint": {"base_url": "fake://local", "authority": "local", "allowed_ports": [1], "follow_redirects": false, "local_plaintext_exception": true},
  "execution_boundary": "local_runner",
  "model_id": "fixture", "model_snapshot": "fixture-1",
  "capabilities": {"structured_output": true, "native_refusal_signal": true, "native_incomplete_signal": true, "tool_calling": true, "source_code_analysis": true, "repository_tool_calls": true, "repository_tools": ["list_paths", "lookup_symbol", "read_range", "read_evidence"], "max_context_tokens": 8192, "max_output_tokens": 2048},
  "data_terms": {"evidence_status": "not_applicable_local", "residency": [], "retention_seconds": 0, "training_use": "not_applicable_local", "zero_data_retention": true, "maximum_input_data_class": "DC3_CONFIDENTIAL_SOURCE", "allowed_purposes": ["model_native_discovery", "candidate_investigation", "skeptic_review", "patch_generation", "evaluation"], "evidence_ref": null},
  "credential_ref": null, "egress_profiles": ["air_gap", "private_model_zdr"],
  "budgets": {"timeout_seconds": 5, "max_attempts": 1, "max_total_tokens": 4096}
}
