{
  "schema_version": "0.2.0", "profile_id": "openai-approved", "profile_version": "1.1.0",
  "provider_kind": "openai", "api_dialect": "openai_responses",
  "endpoint": {"base_url": "https://api.openai.com/v1", "authority": "api.openai.com", "allowed_ports": [443], "follow_redirects": false, "local_plaintext_exception": false},
  "execution_boundary": "public_external",
  "model_id": "approved-model", "model_snapshot": null,
  "capabilities": {"structured_output": true, "native_refusal_signal": true, "native_incomplete_signal": true, "tool_calling": false, "source_code_analysis": false, "repository_tool_calls": false, "repository_tools": [], "max_context_tokens": 100000, "max_output_tokens": 8192},
  "data_terms": {"evidence_status": "verified", "residency": ["policy-selected"], "retention_seconds": 0, "training_use": "none_verified", "zero_data_retention": true, "maximum_input_data_class": "DC2_CONFIDENTIAL_SECURITY", "allowed_purposes": ["evaluation"], "evidence_ref": "evidence://provider-terms/openai-approved"},
  "credential_ref": "env://OPENAI_API_KEY", "egress_profiles": ["metadata_external"],
  "budgets": {"timeout_seconds": 60, "max_attempts": 2, "max_total_tokens": 50000}
}
