{
  "schema_version": "0.2.0", "profile_id": "local-source-model", "profile_version": "1.0.0",
  "provider_kind": "openai_compatible_local", "api_dialect": "openai_compatible",
  "endpoint": {"base_url": "http://127.0.0.1:11434/v1", "authority": "127.0.0.1", "allowed_ports": [11434], "follow_redirects": false, "local_plaintext_exception": true},
  "execution_boundary": "local_runner",
  "model_id": "approved-local-model", "model_snapshot": "fixture-local-1",
  "capabilities": {"structured_output": true, "native_refusal_signal": true, "native_incomplete_signal": true, "tool_calling": true, "source_code_analysis": true, "repository_tool_calls": true, "repository_tools": ["list_paths", "lookup_symbol", "read_range", "read_evidence"], "max_context_tokens": 32768, "max_output_tokens": 4096},
  "data_terms": {"evidence_status": "not_applicable_local", "residency": ["runner-boundary"], "retention_seconds": 0, "training_use": "not_applicable_local", "zero_data_retention": true, "maximum_input_data_class": "DC3_CONFIDENTIAL_SOURCE", "allowed_purposes": ["model_native_discovery", "candidate_investigation", "skeptic_review", "patch_generation", "evaluation"], "evidence_ref": null},
  "credential_ref": null, "egress_profiles": ["private_model_zdr"],
  "budgets": {"timeout_seconds": 60, "max_attempts": 2, "max_total_tokens": 32768}
}
